method	network	commit	batch_size	opt_gap_mean	eq_violation_l1_mean	ineq_violation_l1_mean	merit_mean	avg_inference_time	status	description	save_dir	eval_summary	run_log
penalty	MLP	5931f6b	256	86.51942197	0.35345582	0.00180293	355291.11723903	0.0002026	keep	baseline penalty MLP	results/nonsmooth_nonconvex/socp/SOCPProblem-100-50-50-10000/20260414-213133_penalty_seed2025_e1000_lr1e-04_n7000	results/nonsmooth_nonconvex/socp/SOCPProblem-100-50-50-10000/20260414-213133_penalty_seed2025_e1000_lr1e-04_n7000/test_summary.yaml	logs/autoresearch/20260414-localctxv2-penalty-mlp.log
penalty	LocalContextMLPv2	5931f6b	256	34.81869228	0.12128189	0.00632417	127629.4565817	0.00059101	keep	baseline penalty LocalContextMLPv2	results/nonsmooth_nonconvex/socp/SOCPProblem-100-50-50-10000/20260414-213548_penalty_seed2025_e1000_lr1e-04_n7000_localctxv2d0.2	results/nonsmooth_nonconvex/socp/SOCPProblem-100-50-50-10000/20260414-213548_penalty_seed2025_e1000_lr1e-04_n7000_localctxv2d0.2/test_summary.yaml	logs/autoresearch/20260414-localctxv2-penalty-localctxv2.log
penalty	LocalContextMLPv2	859d880	256	34.12747694	0.10329394	0.00326157	106578.79204963	0.00058252	keep	reduce local delta scale to 0.1	results/nonsmooth_nonconvex/socp/SOCPProblem-100-50-50-10000/20260414-214138_penalty_seed2025_e1000_lr1e-04_n7000_localctxv2d0.1	results/nonsmooth_nonconvex/socp/SOCPProblem-100-50-50-10000/20260414-214138_penalty_seed2025_e1000_lr1e-04_n7000_localctxv2d0.1/test_summary.yaml	logs/autoresearch/20260414-localctxv2-delta0.1.log
penalty	LocalContextMLPv2	c18fcdc	256	35.87768531	0.11030554	0.00274188	113070.99753146	0.00059125	discard	increase coarse loss weight to 1.0	results/nonsmooth_nonconvex/socp/SOCPProblem-100-50-50-10000/20260414-214707_penalty_seed2025_e1000_lr1e-04_n7000_localctxv2d0.1	results/nonsmooth_nonconvex/socp/SOCPProblem-100-50-50-10000/20260414-214707_penalty_seed2025_e1000_lr1e-04_n7000_localctxv2d0.1/test_summary.yaml	logs/autoresearch/20260414-localctxv2-coarse1.0.log
penalty	LocalContextMLPv2	85ca679	256	62.48087458	0.18454676	0.00788455	192459.505671	0.00057003	discard	set penalty.lr=0.00005	results/nonsmooth_nonconvex/socp/SOCPProblem-100-50-50-10000/20260414-220413_penalty_seed2025_e1000_lr5e-05_n7000_localctxv2d0.1	results/nonsmooth_nonconvex/socp/SOCPProblem-100-50-50-10000/20260414-220413_penalty_seed2025_e1000_lr5e-05_n7000_localctxv2d0.1/test_summary.yaml	logs/autoresearch/iter001-20260414-220408.log
penalty	LocalContextMLPv2	2dca78b	256	25.47531792	0.11396869	0.00151546	115505.93034345	0.00057897	discard	set LocalContextMLPv2.local_delta_scale=0.11	results/nonsmooth_nonconvex/socp/SOCPProblem-100-50-50-10000/20260414-220910_penalty_seed2025_e1000_lr1e-04_n7000_localctxv2d0.11	results/nonsmooth_nonconvex/socp/SOCPProblem-100-50-50-10000/20260414-220910_penalty_seed2025_e1000_lr1e-04_n7000_localctxv2d0.11/test_summary.yaml	logs/autoresearch/iter002-20260414-220906.log
penalty	LocalContextMLPv2	9b9806a	256	32.8138455	0.08319417	0.00309478	86311.99940511	0.00057676	keep	set penalty.lr=0.00013	results/nonsmooth_nonconvex/socp/SOCPProblem-100-50-50-10000/20260414-221406_penalty_seed2025_e1000_lr1e-04_n7000_localctxv2d0.1	results/nonsmooth_nonconvex/socp/SOCPProblem-100-50-50-10000/20260414-221406_penalty_seed2025_e1000_lr1e-04_n7000_localctxv2d0.1/test_summary.yaml	logs/autoresearch/iter003-20260414-221402.log
penalty	LocalContextMLPv2	15850e1	256	32.5957424	0.07965789	0.0027083	82389.20134403	0.00058058	keep	set LocalContextMLPv2.local_delta_scale=0.08	results/nonsmooth_nonconvex/socp/SOCPProblem-100-50-50-10000/20260414-221902_penalty_seed2025_e1000_lr1e-04_n7000_localctxv2d0.08	results/nonsmooth_nonconvex/socp/SOCPProblem-100-50-50-10000/20260414-221902_penalty_seed2025_e1000_lr1e-04_n7000_localctxv2d0.08/test_summary.yaml	logs/autoresearch/iter004-20260414-221858.log
penalty	LocalContextMLPv2	7c48268	256	32.91933303	0.09853876	0.0060044	104566.21907596	0.00059029	discard	set hidden_dim=1536	results/nonsmooth_nonconvex/socp/SOCPProblem-100-50-50-10000/20260414-222359_penalty_seed2025_e1000_lr1e-04_n7000_localctxv2d0.08	results/nonsmooth_nonconvex/socp/SOCPProblem-100-50-50-10000/20260414-222359_penalty_seed2025_e1000_lr1e-04_n7000_localctxv2d0.08/test_summary.yaml	logs/autoresearch/iter005-20260414-222355.log
penalty	LocalContextMLPv2	d30e6dc	256	33.69354303	0.09501133	0.00209447	97129.00766192	0.00058064	discard	set penalty.lr=0.0001	results/nonsmooth_nonconvex/socp/SOCPProblem-100-50-50-10000/20260414-225424_penalty_seed2025_e1000_lr1e-04_n7000_localctxv2d0.08	results/nonsmooth_nonconvex/socp/SOCPProblem-100-50-50-10000/20260414-225424_penalty_seed2025_e1000_lr1e-04_n7000_localctxv2d0.08/test_summary.yaml	logs/autoresearch/iter001-20260414-225419.log
penalty	LocalContextMLPv2	67afa9e	256	31.70405251	0.08813138	0.00494803	93102.27237712	0.0005869	discard	set LocalContextMLPv2.local_delta_scale=0.15	results/nonsmooth_nonconvex/socp/SOCPProblem-100-50-50-10000/20260414-225922_penalty_seed2025_e1000_lr1e-04_n7000_localctxv2d0.15	results/nonsmooth_nonconvex/socp/SOCPProblem-100-50-50-10000/20260414-225922_penalty_seed2025_e1000_lr1e-04_n7000_localctxv2d0.15/test_summary.yaml	logs/autoresearch/iter002-20260414-225918.loggit 
penalty	LocalContextMLPv2	8ee6e8d	256	32.04686159	0.07445132	0.00331582	77790.05929423	0.00058776	keep	set penalty.lr=0.00015	results/nonsmooth_nonconvex/socp/SOCPProblem-100-50-50-10000/20260414-230419_penalty_seed2025_e1000_lr1e-04_n7000_localctxv2d0.08	results/nonsmooth_nonconvex/socp/SOCPProblem-100-50-50-10000/20260414-230419_penalty_seed2025_e1000_lr1e-04_n7000_localctxv2d0.08/test_summary.yaml	logs/autoresearch/iter003-20260414-230414.log
penalty	LocalContextMLPv2	99db4dd	256	31.89165548	0.07535452	0.0036336	79011.01665286	0.00058365	discard	set LocalContextMLPv2.local_delta_scale=0.09	results/nonsmooth_nonconvex/socp/SOCPProblem-100-50-50-10000/20260414-230916_penalty_seed2025_e1000_lr1e-04_n7000_localctxv2d0.09	results/nonsmooth_nonconvex/socp/SOCPProblem-100-50-50-10000/20260414-230916_penalty_seed2025_e1000_lr1e-04_n7000_localctxv2d0.09/test_summary.yaml	logs/autoresearch/iter004-20260414-230911.log
penalty	LocalContextMLPv2	8cc90d6	256	27.87586856	0.09980353	0.00194055	101766.25826944	0.0006015	discard	set hidden_dim=768	results/nonsmooth_nonconvex/socp/SOCPProblem-100-50-50-10000/20260414-231413_penalty_seed2025_e1000_lr1e-04_n7000_localctxv2d0.08	results/nonsmooth_nonconvex/socp/SOCPProblem-100-50-50-10000/20260414-231413_penalty_seed2025_e1000_lr1e-04_n7000_localctxv2d0.08/test_summary.yaml	logs/autoresearch/iter005-20260414-231409.log
penalty	LocalContextMLPv2	affee93	256	30.66798089	0.07335653	0.00635723	79736.44545773	0.00060034	discard	set dropout=0.05	results/nonsmooth_nonconvex/socp/SOCPProblem-100-50-50-10000/20260414-231814_penalty_seed2025_e1000_lr1e-04_n7000_localctxv2d0.08	results/nonsmooth_nonconvex/socp/SOCPProblem-100-50-50-10000/20260414-231814_penalty_seed2025_e1000_lr1e-04_n7000_localctxv2d0.08/test_summary.yaml	logs/autoresearch/iter006-20260414-231809.log
penalty	LocalContextMLPv2	2d3ccc7	256	36.28874379	0.09485466	0.00195553	96833.83732235	0.000613	discard	set LocalContextMLPv2.coarse_loss_weight=2	results/nonsmooth_nonconvex/socp/SOCPProblem-100-50-50-10000/20260414-232312_penalty_seed2025_e1000_lr1e-04_n7000_localctxv2d0.08	results/nonsmooth_nonconvex/socp/SOCPProblem-100-50-50-10000/20260414-232312_penalty_seed2025_e1000_lr1e-04_n7000_localctxv2d0.08/test_summary.yaml	logs/autoresearch/iter007-20260414-232308.log
penalty	LocalContextMLPv2	a7d8d9f	256	32.84770608	0.06838707	0.00241737	70827.49505838	0.00059679	keep	set penalty.eq_pen_weight=125	results/nonsmooth_nonconvex/socp/SOCPProblem-100-50-50-10000/20260414-232808_penalty_seed2025_e1000_lr1e-04_n7000_localctxv2d0.08	results/nonsmooth_nonconvex/socp/SOCPProblem-100-50-50-10000/20260414-232808_penalty_seed2025_e1000_lr1e-04_n7000_localctxv2d0.08/test_summary.yaml	logs/autoresearch/iter008-20260414-232804.log
penalty	LocalContextMLPv2	0f3cdbd	256	50.70271461	0.14096363	0.00902309	150012.88635704	0.00058007	discard	set penalty.lr=0.00007	results/nonsmooth_nonconvex/socp/SOCPProblem-100-50-50-10000/20260414-233306_penalty_seed2025_e1000_lr7e-05_n7000_localctxv2d0.08	results/nonsmooth_nonconvex/socp/SOCPProblem-100-50-50-10000/20260414-233306_penalty_seed2025_e1000_lr7e-05_n7000_localctxv2d0.08/test_summary.yaml	logs/autoresearch/iter009-20260414-233301.log
penalty	LocalContextMLPv2	3aa4da7	256	55.8277877	0.08645946	0.00563026	92116.7732068	0.00057942	discard	set LocalContextMLPv2.local_delta_scale=0.12	results/nonsmooth_nonconvex/socp/SOCPProblem-100-50-50-10000/20260414-233804_penalty_seed2025_e1000_lr1e-04_n7000_localctxv2d0.12	results/nonsmooth_nonconvex/socp/SOCPProblem-100-50-50-10000/20260414-233804_penalty_seed2025_e1000_lr1e-04_n7000_localctxv2d0.12/test_summary.yaml	logs/autoresearch/iter010-20260414-233759.log
penalty	LocalContextMLPv2	e208ddd	256	74.92184562	0.08600481	0.01127975	97314.91814461	0.00061247	discard	set num_layers=6	results/nonsmooth_nonconvex/socp/SOCPProblem-100-50-50-10000/20260414-234301_penalty_seed2025_e1000_lr1e-04_n7000_localctxv2d0.08	results/nonsmooth_nonconvex/socp/SOCPProblem-100-50-50-10000/20260414-234301_penalty_seed2025_e1000_lr1e-04_n7000_localctxv2d0.08/test_summary.yaml	logs/autoresearch/iter011-20260414-234256.log
penalty	LocalContextMLPv2	e1cb0a9	256	67.49217023	0.07285182	0.00172199	74602.87255101	0.000579	discard	set hidden_dim=896	results/nonsmooth_nonconvex/socp/SOCPProblem-100-50-50-10000/20260414-234920_penalty_seed2025_e1000_lr1e-04_n7000_localctxv2d0.08	results/nonsmooth_nonconvex/socp/SOCPProblem-100-50-50-10000/20260414-234920_penalty_seed2025_e1000_lr1e-04_n7000_localctxv2d0.08/test_summary.yaml	logs/autoresearch/iter012-20260414-234915.log
penalty	LocalContextMLPv2	0c195c1	256	34.08455228	0.08182776	0.00200101	83852.0438111	0.00059405	discard	set penalty.num_epochs=800	results/nonsmooth_nonconvex/socp/SOCPProblem-100-50-50-10000/20260414-235348_penalty_seed2025_e800_lr1e-04_n7000_localctxv2d0.08	results/nonsmooth_nonconvex/socp/SOCPProblem-100-50-50-10000/20260414-235348_penalty_seed2025_e800_lr1e-04_n7000_localctxv2d0.08/test_summary.yaml	logs/autoresearch/iter013-20260414-235344.log
penalty	LocalContextMLPv2	0b35896	256	61.58344516	0.09526261	0.00140882	96699.4703884	0.00057045	discard	set dropout=0.3	results/nonsmooth_nonconvex/socp/SOCPProblem-100-50-50-10000/20260414-235746_penalty_seed2025_e1000_lr1e-04_n7000_localctxv2d0.08	results/nonsmooth_nonconvex/socp/SOCPProblem-100-50-50-10000/20260414-235746_penalty_seed2025_e1000_lr1e-04_n7000_localctxv2d0.08/test_summary.yaml	logs/autoresearch/iter014-20260414-235742.log
penalty	LocalContextMLPv2	075c855	256	31.1907318	0.05766042	0.00502582	62709.00873331	0.0005731	keep	set penalty.lr=0.0002	results/nonsmooth_nonconvex/socp/SOCPProblem-100-50-50-10000/20260415-000243_penalty_seed2025_e1000_lr2e-04_n7000_localctxv2d0.08	results/nonsmooth_nonconvex/socp/SOCPProblem-100-50-50-10000/20260415-000243_penalty_seed2025_e1000_lr2e-04_n7000_localctxv2d0.08/test_summary.yaml	logs/autoresearch/iter015-20260415-000239.log
penalty	LocalContextMLPv2	14d364d	256	30.76093905	0.06050526	0.00712888	67656.84089894	0.00058681	discard	set penalty.ineq_pen_weight=40	results/nonsmooth_nonconvex/socp/SOCPProblem-100-50-50-10000/20260415-000739_penalty_seed2025_e1000_lr2e-04_n7000_localctxv2d0.08	results/nonsmooth_nonconvex/socp/SOCPProblem-100-50-50-10000/20260415-000739_penalty_seed2025_e1000_lr2e-04_n7000_localctxv2d0.08/test_summary.yaml	logs/autoresearch/iter016-20260415-000735.log
penalty	LocalContextMLPv2	61964dd	256	30.19213269	0.05140121	0.00867922	60103.02815762	0.00058538	keep	set batch_size=384	results/nonsmooth_nonconvex/socp/SOCPProblem-100-50-50-10000/20260415-001236_penalty_seed2025_e1000_lr2e-04_n7000_localctxv2d0.08	results/nonsmooth_nonconvex/socp/SOCPProblem-100-50-50-10000/20260415-001236_penalty_seed2025_e1000_lr2e-04_n7000_localctxv2d0.08/test_summary.yaml	logs/autoresearch/iter017-20260415-001232.log
penalty	LocalContextMLPv2	5fd88fe	256	29.82215524	0.04634368	0.00993992	56306.13415664	0.00058427	keep	set penalty.num_epochs=1200	results/nonsmooth_nonconvex/socp/SOCPProblem-100-50-50-10000/20260415-001809_penalty_seed2025_e1200_lr2e-04_n7000_localctxv2d0.08	results/nonsmooth_nonconvex/socp/SOCPProblem-100-50-50-10000/20260415-001809_penalty_seed2025_e1200_lr2e-04_n7000_localctxv2d0.08/test_summary.yaml	logs/autoresearch/iter018-20260415-001805.log
penalty	LocalContextMLPv2	8d0bfa7	256	33.02781721	0.06536048	0.00365184	69035.40386336	0.00058883	discard	set batch_size=768	results/nonsmooth_nonconvex/socp/SOCPProblem-100-50-50-10000/20260415-002448_penalty_seed2025_e1200_lr2e-04_n7000_localctxv2d0.08	results/nonsmooth_nonconvex/socp/SOCPProblem-100-50-50-10000/20260415-002448_penalty_seed2025_e1200_lr2e-04_n7000_localctxv2d0.08/test_summary.yaml	logs/autoresearch/iter019-20260415-002444.log
penalty	LocalContextMLPv2	b428410	256	29.72617446	0.05206862	0.00654459	58635.72351328	0.00057623	discard	set penalty.ineq_pen_weight=75	results/nonsmooth_nonconvex/socp/SOCPProblem-100-50-50-10000/20260415-003042_penalty_seed2025_e1200_lr2e-04_n7000_localctxv2d0.08	results/nonsmooth_nonconvex/socp/SOCPProblem-100-50-50-10000/20260415-003042_penalty_seed2025_e1200_lr2e-04_n7000_localctxv2d0.08/test_summary.yaml	logs/autoresearch/iter020-20260415-003038.log
penalty	LocalContextMLPv2	7b6df6b	256	28.5844038	0.0615321	0.01374623	75300.65007669	0.00057355	discard	set penalty.eq_pen_weight=100	results/nonsmooth_nonconvex/socp/SOCPProblem-100-50-50-10000/20260415-003721_penalty_seed2025_e1200_lr2e-04_n7000_localctxv2d0.08	results/nonsmooth_nonconvex/socp/SOCPProblem-100-50-50-10000/20260415-003721_penalty_seed2025_e1200_lr2e-04_n7000_localctxv2d0.08/test_summary.yaml	logs/autoresearch/iter021-20260415-003717.log
penalty	LocalContextMLPv2	8166862	256	30.89558504	0.05808252	0.00629153	64396.77157881	0.00057673	discard	set LocalContextMLPv2.coarse_loss_weight=1.5	results/nonsmooth_nonconvex/socp/SOCPProblem-100-50-50-10000/20260415-004359_penalty_seed2025_e1200_lr2e-04_n7000_localctxv2d0.08	results/nonsmooth_nonconvex/socp/SOCPProblem-100-50-50-10000/20260415-004359_penalty_seed2025_e1200_lr2e-04_n7000_localctxv2d0.08/test_summary.yaml	logs/autoresearch/iter022-20260415-004355.log
penalty	LocalContextMLPv2	5e28fde	256	34.48884868	0.09453787	0.01103213	105593.34870951	0.0005987	discard	set num_layers=5	results/nonsmooth_nonconvex/socp/SOCPProblem-100-50-50-10000/20260415-005036_penalty_seed2025_e1200_lr2e-04_n7000_localctxv2d0.08	results/nonsmooth_nonconvex/socp/SOCPProblem-100-50-50-10000/20260415-005036_penalty_seed2025_e1200_lr2e-04_n7000_localctxv2d0.08/test_summary.yaml	logs/autoresearch/iter023-20260415-005032.log
penalty	LocalContextMLPv2	7742be8	256	30.45367624	0.05636426	0.00726228	63649.18114801	0.00057358	discard	set LocalContextMLPv2.coarse_loss_weight=1.25	results/nonsmooth_nonconvex/socp/SOCPProblem-100-50-50-10000/20260415-005810_penalty_seed2025_e1200_lr2e-04_n7000_localctxv2d0.08	results/nonsmooth_nonconvex/socp/SOCPProblem-100-50-50-10000/20260415-005810_penalty_seed2025_e1200_lr2e-04_n7000_localctxv2d0.08/test_summary.yaml	logs/autoresearch/iter024-20260415-005805.log
penalty	LocalContextMLPv2	834b0d8	256	30.4932342	0.04932277	0.00836191	57707.32788934	0.00057924	discard	set LocalContextMLPv2.coarse_loss_weight=0.75	results/nonsmooth_nonconvex/socp/SOCPProblem-100-50-50-10000/20260415-010449_penalty_seed2025_e1200_lr2e-04_n7000_localctxv2d0.08	results/nonsmooth_nonconvex/socp/SOCPProblem-100-50-50-10000/20260415-010449_penalty_seed2025_e1200_lr2e-04_n7000_localctxv2d0.08/test_summary.yaml	logs/autoresearch/iter025-20260415-010445.log
penalty	LocalContextMLPv2	a176c49	256	55.40366024	0.06302693	0.00844126	71495.15867821	0.00057366	discard	set penalty.ineq_pen_weight=60	results/nonsmooth_nonconvex/socp/SOCPProblem-100-50-50-10000/20260415-011129_penalty_seed2025_e1200_lr2e-04_n7000_localctxv2d0.08	results/nonsmooth_nonconvex/socp/SOCPProblem-100-50-50-10000/20260415-011129_penalty_seed2025_e1200_lr2e-04_n7000_localctxv2d0.08/test_summary.yaml	logs/autoresearch/iter026-20260415-011125.log
penalty	LocalContextMLPv2	1e41154	256	52.99387006	0.05372715	0.01072541	64479.11761295	0.00057998	discard	set penalty.eq_pen_weight=200	results/nonsmooth_nonconvex/socp/SOCPProblem-100-50-50-10000/20260415-011807_penalty_seed2025_e1200_lr2e-04_n7000_localctxv2d0.08	results/nonsmooth_nonconvex/socp/SOCPProblem-100-50-50-10000/20260415-011807_penalty_seed2025_e1200_lr2e-04_n7000_localctxv2d0.08/test_summary.yaml	logs/autoresearch/iter027-20260415-011802.log
penalty	LocalContextMLPv2	675402a	256	55.0257693	0.06546122	0.0055761	71064.23341859	0.00058317	discard	set dropout=0.25	results/nonsmooth_nonconvex/socp/SOCPProblem-100-50-50-10000/20260415-012445_penalty_seed2025_e1200_lr2e-04_n7000_localctxv2d0.08	results/nonsmooth_nonconvex/socp/SOCPProblem-100-50-50-10000/20260415-012445_penalty_seed2025_e1200_lr2e-04_n7000_localctxv2d0.08/test_summary.yaml	logs/autoresearch/iter028-20260415-012441.log
penalty	LocalContextMLPv2	5bfaa86	256	14.18687188	0.06982844	0.00435639	74204.6613041	0.00055206	discard	set num_layers=3	results/nonsmooth_nonconvex/socp/SOCPProblem-100-50-50-10000/20260415-013124_penalty_seed2025_e1200_lr2e-04_n7000_localctxv2d0.08	results/nonsmooth_nonconvex/socp/SOCPProblem-100-50-50-10000/20260415-013124_penalty_seed2025_e1200_lr2e-04_n7000_localctxv2d0.08/test_summary.yaml	logs/autoresearch/iter029-20260415-013120.log
penalty	LocalContextMLPv2	c709011	256	30.26878511	0.05211315	0.00790137	60037.1353999	0.00057784	discard	set batch_size=512	results/nonsmooth_nonconvex/socp/SOCPProblem-100-50-50-10000/20260415-013707_penalty_seed2025_e1200_lr2e-04_n7000_localctxv2d0.08	results/nonsmooth_nonconvex/socp/SOCPProblem-100-50-50-10000/20260415-013707_penalty_seed2025_e1200_lr2e-04_n7000_localctxv2d0.08/test_summary.yaml	logs/autoresearch/iter030-20260415-013703.log
penalty	LocalContextMLPv2	f9f4b11	256	56.54918708	0.0542006	0.01498863	69216.39881724	0.00057498	discard	set LocalContextMLPv2.local_delta_scale=0.03	results/nonsmooth_nonconvex/socp/SOCPProblem-100-50-50-10000/20260415-014302_penalty_seed2025_e1200_lr2e-04_n7000_localctxv2d0.03	results/nonsmooth_nonconvex/socp/SOCPProblem-100-50-50-10000/20260415-014302_penalty_seed2025_e1200_lr2e-04_n7000_localctxv2d0.03/test_summary.yaml	logs/autoresearch/iter031-20260415-014258.log
penalty	LocalContextMLPv2	de2a72e	256	61.53559062	0.06537837	0.00630609	71712.496484	0.00056669	discard	set penalty.ineq_pen_weight=100	results/nonsmooth_nonconvex/socp/SOCPProblem-100-50-50-10000/20260415-014941_penalty_seed2025_e1200_lr2e-04_n7000_localctxv2d0.08	results/nonsmooth_nonconvex/socp/SOCPProblem-100-50-50-10000/20260415-014941_penalty_seed2025_e1200_lr2e-04_n7000_localctxv2d0.08/test_summary.yaml	logs/autoresearch/iter032-20260415-014937.log
penalty	LocalContextMLPv2	ef3fcdb	256	22.50351466	0.09310232	0.01785159	110975.18023119	0.00058526	discard	set penalty.ineq_pen_weight=25	results/nonsmooth_nonconvex/socp/SOCPProblem-100-50-50-10000/20260415-015620_penalty_seed2025_e1200_lr2e-04_n7000_localctxv2d0.08	results/nonsmooth_nonconvex/socp/SOCPProblem-100-50-50-10000/20260415-015620_penalty_seed2025_e1200_lr2e-04_n7000_localctxv2d0.08/test_summary.yaml	logs/autoresearch/iter033-20260415-015616.log
penalty	LocalContextMLPv2	ea221ba	256	29.74562069	0.07046658	0.01284015	83329.24897664	0.00058746	discard	set penalty.eq_pen_weight=75	results/nonsmooth_nonconvex/socp/SOCPProblem-100-50-50-10000/20260415-020259_penalty_seed2025_e1200_lr2e-04_n7000_localctxv2d0.08	results/nonsmooth_nonconvex/socp/SOCPProblem-100-50-50-10000/20260415-020259_penalty_seed2025_e1200_lr2e-04_n7000_localctxv2d0.08/test_summary.yaml	logs/autoresearch/iter034-20260415-020255.log
penalty	LocalContextMLPv2	b78662a	256	30.19213269	0.05140121	0.00867922	60103.02815762	0.0005846	discard	set penalty.num_epochs=1000	results/nonsmooth_nonconvex/socp/SOCPProblem-100-50-50-10000/20260415-020938_penalty_seed2025_e1000_lr2e-04_n7000_localctxv2d0.08	results/nonsmooth_nonconvex/socp/SOCPProblem-100-50-50-10000/20260415-020938_penalty_seed2025_e1000_lr2e-04_n7000_localctxv2d0.08/test_summary.yaml	logs/autoresearch/iter035-20260415-020934.log
penalty	LocalContextMLPv2	8ec4d1a	256	30.08159521	0.04164407	0.00847968	50146.33349698	0.00058636	keep	set penalty.eq_pen_weight=150	results/nonsmooth_nonconvex/socp/SOCPProblem-100-50-50-10000/20260415-021510_penalty_seed2025_e1200_lr2e-04_n7000_localctxv2d0.08	results/nonsmooth_nonconvex/socp/SOCPProblem-100-50-50-10000/20260415-021510_penalty_seed2025_e1200_lr2e-04_n7000_localctxv2d0.08/test_summary.yaml	logs/autoresearch/iter036-20260415-021506.log
penalty	LocalContextMLPv2	0138f08	256	8.95502997	0.04104827	0.01667264	57739.81670434	0.00057021	discard	set LocalContextMLPv2.coarse_loss_weight=0.1	results/nonsmooth_nonconvex/socp/SOCPProblem-100-50-50-10000/20260415-022148_penalty_seed2025_e1200_lr2e-04_n7000_localctxv2d0.08	results/nonsmooth_nonconvex/socp/SOCPProblem-100-50-50-10000/20260415-022148_penalty_seed2025_e1200_lr2e-04_n7000_localctxv2d0.08/test_summary.yaml	logs/autoresearch/iter037-20260415-022144.log
penalty	LocalContextMLPv2	2dd6c2e	256	31.36142245	0.04848524	0.00572522	54233.26101482	0.00057071	discard	set LocalContextMLPv2.coarse_loss_weight=1	results/nonsmooth_nonconvex/socp/SOCPProblem-100-50-50-10000/20260415-022826_penalty_seed2025_e1200_lr2e-04_n7000_localctxv2d0.08	results/nonsmooth_nonconvex/socp/SOCPProblem-100-50-50-10000/20260415-022826_penalty_seed2025_e1200_lr2e-04_n7000_localctxv2d0.08/test_summary.yaml	logs/autoresearch/iter038-20260415-022821.log
