method	network	commit	batch_size	opt_gap_mean	eq_violation_l1_mean	ineq_violation_l1_mean	merit_mean	avg_inference_time	status	description	save_dir	eval_summary	run_log
penalty	LocalContextMLPv2	d3b8d90	256	35.99762676	0.07144727	0.00233255	73803.41636878	0.00058714	discard	set batch_size=1024	results/nonsmooth_nonconvex/socp/SOCPProblem-100-50-50-10000/20260415-023503_penalty_seed2025_e1200_lr2e-04_n7000_localctxv2d0.08	results/nonsmooth_nonconvex/socp/SOCPProblem-100-50-50-10000/20260415-023503_penalty_seed2025_e1200_lr2e-04_n7000_localctxv2d0.08/test_summary.yaml	logs/autoresearch/iter039-20260415-023459.log
penalty	LocalContextMLPv2	dc45cef	256	29.58813451	0.03740152	0.01186264	49286.64701995	0.00057161	keep	set batch_size=256	results/nonsmooth_nonconvex/socp/SOCPProblem-100-50-50-10000/20260415-024043_penalty_seed2025_e1200_lr2e-04_n7000_localctxv2d0.08	results/nonsmooth_nonconvex/socp/SOCPProblem-100-50-50-10000/20260415-024043_penalty_seed2025_e1200_lr2e-04_n7000_localctxv2d0.08/test_summary.yaml	logs/autoresearch/iter040-20260415-024038.log
penalty	LocalContextMLPv2	4931e0d	256	9.42616093	0.04572739	0.02306904	68815.43466698	0.00057217	discard	set dropout=0	results/nonsmooth_nonconvex/socp/SOCPProblem-100-50-50-10000/20260415-024737_penalty_seed2025_e1200_lr2e-04_n7000_localctxv2d0.08	results/nonsmooth_nonconvex/socp/SOCPProblem-100-50-50-10000/20260415-024737_penalty_seed2025_e1200_lr2e-04_n7000_localctxv2d0.08/test_summary.yaml	logs/autoresearch/iter041-20260415-024733.log
penalty	LocalContextMLPv2	7beb5f5	256	30.14039128	0.04092965	0.00977167	50723.90176192	0.00056067	discard	set dropout=0.15	results/nonsmooth_nonconvex/socp/SOCPProblem-100-50-50-10000/20260415-025431_penalty_seed2025_e1200_lr2e-04_n7000_localctxv2d0.08	results/nonsmooth_nonconvex/socp/SOCPProblem-100-50-50-10000/20260415-025431_penalty_seed2025_e1200_lr2e-04_n7000_localctxv2d0.08/test_summary.yaml	logs/autoresearch/iter042-20260415-025427.log
penalty	LocalContextMLPv2	f915e59	256	29.54683808	0.03670626	0.01358873	50317.47114768	0.00055563	discard	set LocalContextMLPv2.local_delta_scale=0.05	results/nonsmooth_nonconvex/socp/SOCPProblem-100-50-50-10000/20260415-030126_penalty_seed2025_e1200_lr2e-04_n7000_localctxv2d0.05	results/nonsmooth_nonconvex/socp/SOCPProblem-100-50-50-10000/20260415-030126_penalty_seed2025_e1200_lr2e-04_n7000_localctxv2d0.05/test_summary.yaml	logs/autoresearch/iter043-20260415-030122.log
penalty	LocalContextMLPv2	facf891	256	30.8322686	0.05011894	0.00674963	56891.27481906	0.00057068	discard	set dropout=0.2	results/nonsmooth_nonconvex/socp/SOCPProblem-100-50-50-10000/20260415-030819_penalty_seed2025_e1200_lr2e-04_n7000_localctxv2d0.08	results/nonsmooth_nonconvex/socp/SOCPProblem-100-50-50-10000/20260415-030819_penalty_seed2025_e1200_lr2e-04_n7000_localctxv2d0.08/test_summary.yaml	logs/autoresearch/iter044-20260415-030815.log
penalty	LocalContextMLPv2	7e4079f	256	18.19610289	0.20093501	0.00664839	207603.92749307	0.00057077	discard	set LocalContextMLPv2.coarse_loss_weight=0	results/nonsmooth_nonconvex/socp/SOCPProblem-100-50-50-10000/20260415-031513_penalty_seed2025_e1200_lr2e-04_n7000_localctxv2d0.08	results/nonsmooth_nonconvex/socp/SOCPProblem-100-50-50-10000/20260415-031513_penalty_seed2025_e1200_lr2e-04_n7000_localctxv2d0.08/test_summary.yaml	logs/autoresearch/iter045-20260415-031509.log
